### ISSUE TITLE
Regression in #1215

### ISSUE THREAD

**Issue by cardonator** [gocql/gocql#1253]
### What version of Cassandra are you using?
DSE 5.1.9 based on Apache Cassandra 3.1.1

### What version of Gocql are you using?
master, 44e29ed5b8a4b4fff39d7ebaa19976c6f852075b, 26b68fd731048f2db526e5e6147a69330cb241bc

### What did you do?
Ran a script that tried to create a session with the external host through an SSH tunnel.

### What did you expect to see?
Expected to see a successful connection that can run queries.

### What did you see instead?

The connection fails with the error `2019/01/14 17:03:28 gocql: unable to create session: control: unable to setup connection: gocql: no response received from cassandra within timeout period`
---
Debug output information from commit 26b68fd731048f2db526e5e6147a69330cb241bc
```
2019/01/14 17:11:13 Starting up...
2019/01/14 17:11:13 Connected, creating session...
2019/01/14 17:11:14 gocql: Session.handleNodeUp: 10.15.0.22:19042
2019/01/14 17:11:14 connection failed "10.15.0.22": dial tcp 10.15.0.22:19042: i/o timeout, reconnecting with *gocql.ConstantReconnectionPolicy
2019/01/14 17:11:16 connection failed "10.15.0.22": dial tcp 10.15.0.22:19042: i/o timeout, reconnecting with *gocql.ConstantReconnectionPolicy
2019/01/14 17:11:17 connection failed "10.15.0.22": dial tcp 10.15.0.22:19042: i/o timeout, reconnecting with *gocql.ConstantReconnectionPolicy
2019/01/14 17:11:18 unable to dial "10.15.0.22": dial tcp 10.15.0.22:19042: i/o timeout
2019/01/14 17:11:19 gocql: Session.handleNodeDown: 10.15.0.22:19042
2019/01/14 17:11:19 Session created, processing
```
Debug output information from commit 44e29ed5b8a4b4fff39d7ebaa19976c6f852075b
```
2019/01/14 17:11:52 Starting up...
2019/01/14 17:11:52 Connected, creating session...
2019/01/14 17:11:53 gocql: unable to create session: control: unable to setup connection: gocql: no response received from cassandra within timeout period
2019/01/14 17:11:53 unable to connect to database
```
Please let me know what other information I should provide. I am able to reproduce this consistently on commits newer than 26b68fd731048f2db526e5e6147a69330cb241bc.

**Comment by Zariel** [comment]
can you tcpdump from the client all packets going to :9042 please?

**Comment by alourie** [comment]
@cardonator is this still an issue? Thanks

**Comment by cardonator** [comment]
Yes, sorry. I keep meaning to get the tcpdump but have been too busy at work.

**Comment by alourie** [comment]
@cardonator any updates? ;-)

**Comment by alourie** [comment]
@cardonator poking again :-)

**Comment by cardonator** [comment]
Sorry all for the long wait, but I'm finally revisiting this.

I ran a tcpdump on both 26b68fd and master:

tcpdump on 26b68fd
```$ sudo tcpdump -nn -l port 19042
tcpdump: verbose output suppressed, use -v or -vv for full protocol decode
listening on wlp58s0, link-type EN10MB (Ethernet), capture size 262144 bytes
08:24:18.715672 IP 192.168.86.47.37134 > 10.15.0.22.19042: Flags [S], seq 553483990, win 29200, options [mss 1460,sackOK,TS val 2247140869 ecr 0,nop,wscale 7], length 0
08:24:20.316583 IP 192.168.86.47.37136 > 10.15.0.22.19042: Flags [S], seq 1289764100, win 29200, options [mss 1460,sackOK,TS val 2247142470 ecr 0,nop,wscale 7], length 0
08:24:21.917017 IP 192.168.86.47.37138 > 10.15.0.22.19042: Flags [S], seq 3274846682, win 29200, options [mss 1460,sackOK,TS val 2247144071 ecr 0,nop,wscale 7], length 0```

The tcpdump on master is completely empty. If I'm missing a helpful tcpdump param, let me know.

**Comment by cardonator** [comment]
Anyone have any further help to provide here? I can reproduce this consistently when I try to connect to a single node of a Cassandra cluster through an SSH tunnel.

**Comment by cardonator** [comment]
@alourie just pinging to see if you have any thoughts about providing more information here. I tried on the latest release and master and still see the same behavior when connecting to a cluster through an SSH tunnel.

**Comment by alourie** [comment]
@cardonator are you saying that the driver works consistently fine for versions prior to https://github.com/gocql/gocql/commit/26b68fd731048f2db526e5e6147a69330cb241bc? And consistently doesn't for the later ones? Cause that's a bit surprising, clearly we haven't changed anything in that specific commit....

**Comment by cardonator** [comment]
For the specific case of connecting to a Cassandra cluster by SSH tunnel directly to one of the nodes, yes that is the behavior I am experiencing.

The change in this PR is the only culprit that I can find. https://github.com/gocql/gocql/pull/1215 The commit immediately prior to this works perfectly fine. This commit and every commit afterward does not work returning the error mentioned above.

To clarify, 26b68fd is the last working commit. 44e29ed is the first non-working commit.

Both commits work perfectly fine accessing the cluster from within the same network with access to all nodes of the cluster.

**Comment by cardonator** [comment]
And, in case it helps, the code I'm using to connect to the cluster is:
```var cluster *gocql.ClusterConfig
cluster = gocql.NewCluster("localhost:19042")
cluster.Consistency = gocql.LocalOne

cluster.Authenticator = gocql.PasswordAuthenticator{
    Username: "cassandra",
    Password: "password",
}
cluster.Keyspace = "home"
cluster.ProtoVersion = 4
cluster.DisableInitialHostLookup = false
cluster.Timeout = time.Second * 10

session, err := cluster.CreateSession()
if err != nil {
    log.Debug("There was an error creating the Cassandra connection ", err)
    log.Critical("Error connecting to cassandra")
}```

**Comment by cardonator** [comment]
Hi all, I tried this out on latest today and it seems to be resolved now. No clue what changed, but good work I guess! 🥇
